Key,Description,en,es
tut:Vertical Flight:HeadTowardPad31,A tutorial label,Begin to move towards the pad.  Adjust your altitude control and steer so your velocity vector is pointed just above the pad.,Empieza a moverte hacia el aparcamiento. Ajusta el control de altitud y muevete para que tu vector de velocidad apunte justo encima del helipuerto.
tut:Vertical Flight:AlmostLand32,A tutorial label,Slow your forward speed and rate of descent.,.Reduce tu velocidad y ratio de descenso.
tut:Vertical Flight:Land33,A tutorial label,Adjust rate of descent to bring it down gently.,Ajusta el ratio de descenso para bajarlo lentamente.
tut:Vertical Flight:Touchdown34,A tutorial label,Touch down!  Throttle down and enable brake locks.,¡Aterrizado! Baja el acelerador y pon el freno de mano.
tut:Vertical Flight:Brake Locks35,A tutorial label,Enable brake lock.,Pon el freno de mano.
tut:Vertical Flight:Congrats36,A tutorial label,Congratulations!  Next time: Manual vertical flight and transitioning.,¡Enhorabuena! Siguiente: Manual de vuelo vertical y transicionarmiento.
PGM-27 x19_fullName,Full equip name of: PGM-27 x19,PGM-27 x19,
PGM-27 x19_description,Item description of: PGM-27 x19,"A rack of 2.75 inch rockets which have been fitted with a laser guidance package, turning them into precision guided munitions.
Requires continuous lock for guidance (not fire-and-forget).","Un Pilón de cohetes de 2.75 pulgadas al que se les ha acomodado un paquete de guiado láser, convirtiendolos en municiones guiadas precisas.
Requiere visual continuo con el objetivo"
EUCAV GUN_fullName,Full equip name of: EUCAV GUN,EUCAV GUN,
EUCAV GUN_description,Item description of: EUCAV GUN,EUCAV GUN,
eqSublabel_GPS-BOMB-INTERNAL,HUD sub-label of an equip,GPS BOMB INTERNAL,BOMBA GPS INTERNA
Mk.82 Bomb x3_fullName,Full equip name of: Mk.82 Bomb x3,Mk.82 Bomb x3,Bomba Mk.82 x3
Mk.82 Bomb x3_description,Item description of: Mk.82 Bomb x3,Standard un-guided 500lb bombs.,Bombas estandar de 500lb sin guiado.
ASF-SRM-RA x2_fullName,Full equip name of: ASF-SRM-RA x2,ASF-SRM-RA x2,
ASF-SRM-RA x2_description,Item description of: ASF-SRM-RA x2,A rack of two older rear-aspect heat-seeking anti-air missiles.,Un pilón de 2 misiles de generación anterior Aire-Aire Guiado por calor de aspecto trasero.
AGM-114 x4_fullName,Full equip name of: AGM-114 x4,AGM-114 x4,
AGM-114 x4_description,Item description of: AGM-114 x4,"A rack of 4 laser guided anti-tank missiles.
Requires continuous lock for guidance (not fire-and-forget).","Un pilón de 4 misiles anti-tanque guiados por láser.
Requiere visual contino con el objetivo."
Mk-82AIR High Drag Bomb x2_fullName,Full equip name of: Mk-82AIR High Drag Bomb x2,Mk-82AIR High Drag Bomb x2,Bomba Mk-82AIR x2
Mk-82AIR High Drag Bomb x2_description,Item description of: Mk-82AIR High Drag Bomb x2,Standard un-guided 500lb bombs. Deploys an inflatable drag chute to slow descent for low altitude bombing.,Bomba estandar de 500lb sin guiado. Despliega un paracaídas de descenso lento para bombardeos a baja altitud.
GMA-6 x2_fullName,Full equip name of: GMA-6 x2,GMA-6 x2,
GMA-6 x2_description,Item description of: GMA-6 x2,"A medium range optically guided ""fire-and-forget"" anti-tank missile.",Un misil anti-tanque de medio alcance ópticamente guiado (fire-and-forget).
GBU-39 SD Bomb x4_fullName,Full equip name of: GBU-39 SD Bomb x4,GBU-39 SD Bomb x4,Bomba GBU-29 SD x4
GBU-39 SD Bomb x4_description,Item description of: GBU-39 SD Bomb x4,GPS guided small diameter bomb. It has built-in folding wings that allow it to glide for long distances and hit targets with precision.,Bomba guiada por GPS de pequeño diámetro. Tiene unas alas que le permite planear a grandes distancias y alcanzar el objetivo con precisión
BSM-66LR_fullName,Full equip name of: BSM-66LR,BSM-66LR,
BSM-66LR_description,Item description of: BSM-66LR,Standard semi-active radar-guided surface to air missile. Equipped with first stage booster for extended range.,"Misil Tierra-Aire estandar guiado por radar semi-activo.
Equipado con un impulsor de primera etapa para un rango extendido."
ASF-SRM x3_fullName,Full equip name of: ASF-SRM x3,ASF-SRM x3,
ASF-SRM x3_description,Item description of: ASF-SRM x3,A rack of three standard heat-seeking anti-air missiles.,Un pilón de tres misiles estandar guiado por calor anti aéreo
eqSublabel_LASER-BOMB-INTERNAL,HUD sub-label of an equip,LASER BOMB INTERNAL,BOMBA LASER INTERNA
AGM-145 Ballista x2_fullName,Full equip name of: AGM-145 Ballista x2,AGM-145 Ballista x2,
AGM-145 Ballista x2_description,Item description of: AGM-145 Ballista x2,"Small anti-tank missiles with advanced optics, ""fire and forget"", and smart self-targeting technology. Can be fired without line of sight to the designated target point, and will acquire hostile targets automatically.","Pequeño misil anti-tanque con ópticas avanzadas, """"tira y olvida"""" y tecnología inteligente de auto-asignación de objetivo. Puede ser disparado sin lina de visión al punto objetivo designado y el misil adquirirá el objetivo automaticamente.""
eqSublabel_OPTICAL-FAF,HUD sub-label of an equip,OPTICAL FAF,"
AGM-188 MARM_fullName,Full equip name of: AGM-188 MARM,AGM-188 MARM,
AGM-188 MARM_description,Item description of: AGM-188 MARM,Medium range anti-radiation missile with a unique top down attack angle.,Misil anti-radiación de medio alcance con ángulo de ataque descendente.
ASRM-93 x2_fullName,Full equip name of: ASRM-93 x2,ASRM-93 x2,
ASRM-93 x2_description,Item description of: ASRM-93 x2,Heat seeking short range air to air missiles.  Internally stowed.,Misil Aire-Aire guiado por calor de corto alcance. Almacenado internamente.
AGM-145 Ballista x3_fullName,Full equip name of: AGM-145 Ballista x3,AGM-145 Ballista x3,
AGM-145 Ballista x3_description,Item description of: AGM-145 Ballista x3,"Small anti-tank missiles with advanced optics, ""fire and forget"", and smart self-targeting technology. Can be fired without line of sight to the designated target point, and will acquire hostile targets automatically.","Pequeño misil anti-tanque con ópticas avanzadas, """"tira y olvida"""" y tecnología inteligente de auto-asignación de objetivo. Puede ser disparado sin lina de visión al punto objetivo designado y el misil adquirirá el objetivo automaticamente.
eqSublabel_OPTICAL-FAF,HUD sub-label of an equip,OPTICAL FAF,"
ASF-SRM-RA x3_fullName,Full equip name of: ASF-SRM-RA x3,ASF-SRM-RA x3,
ASF-SRM-RA x3_description,Item description of: ASF-SRM-RA x3,A rack of three older rear-aspect heat-seeking anti-air missiles.,Un pilón de tres misiles de generación anterior anti-aéreo guiado por calor de aspecto trasero.
Backstop_fullName,Full equip name of: Backstop,Backstop,
Backstop_description,Item description of: Backstop,Standard semi-active radar-guided surface to air missile.,Misil estandar Tierra-Aire guiado por radar semi-activo.
ASMRM-1 x1_fullName,Full equip name of: ASMRM-1 x1,ASMRM-1 x1,
ASMRM-1 x1_description,Item description of: ASMRM-1 x1,"Older, medium range semi-active radar air to air missile. Requires radar lock until intercept.","De generacion anterior, misil Aire-Aire de medio alcance por radar semi-activo.
Requiere bloqueo de radar hasta interceptar."
AIM-9E Sidewinder_fullName,Full equip name of: AIM-9E Sidewinder,AIM-9E Sidewinder,
AIM-9E Sidewinder_description,Item description of: AIM-9E Sidewinder,"A single AIM-9E. An older short range, rear-aspect, heat seeking air to air missile.","Un solo AIM-9E. Misil de generación anterior, guiado por calor de aspecto trasero y corto alcance."
Hydra-70 x14 Rocket Pod_fullName,Full equip name of: Hydra-70 x14 Rocket Pod,Hydra-70 x14 Rocket Pod,Contenedor de Cohetes Hydra-70 x14
Hydra-70 x14 Rocket Pod_description,Item description of: Hydra-70 x14 Rocket Pod,"A pair of pods carrying a total of 14 high explosive rockets.  Can be fired in single shot mode, or rapid fire (ripple).",Un par de contenedores llevando un total de 14 cohetes AE. Puede ser disparado en semi o ráfaga.
mfdpOpenMenu,Tooltip for button that opens a menu.,Open Menu,Abrir Menú
mfdpBLANK,Label for a minimized MFD portal that is empty. Opens the portal menu.,BLANK,VACÍO
MFDPortalHome_MFDPortalPage_pageName,MFD portal page name,Menu,Menú
MFDPortalHome_MFDPortalPage_pageLabel,MFD portal page button label,MENU,MENU
MapMFDPage_MFDPortalPage_pageName,MFD portal page name,Nav Map,Map Nav
MapMFDPage_MFDPortalPage_pageLabel,MFD portal page button label,NAV,
ObjectivesPage_MFDPortalPage_pageName,MFD portal page name,Objectives,Objetivos
ObjectivesPage_MFDPortalPage_pageLabel,MFD portal page button label,OBJCTV,OBJETV
SCamPage_MFDPortalPage_pageName,MFD portal page name,SpectatorCam,CamEspectador
SCamPage_MFDPortalPage_pageLabel,MFD portal page button label,S-CAM,E-CAM
RWRPage_MFDPortalPage_pageName,MFD portal page name,RWR,
RWRPage_MFDPortalPage_pageLabel,MFD portal page button label,RWR,
OptionsPage_MFDPortalPage_pageName,MFD portal page name,Vehicle Options,Opciones Vehiculo
OptionsPage_MFDPortalPage_pageLabel,MFD portal page button label,OPTS,OPCS
F-45A_mfd_altitudeSettings:T5_tooltip,Tooltip for an MFD button.,Back,Volver
F-45A_mfd_altitudeSettings:L3_tooltip,Tooltip for an MFD button.,Min Alt +,
F-45A_mfd_altitudeSettings:L4_tooltip,Tooltip for an MFD button.,Min Alt -,
F-45A_mfd_altitudeSettings:R3_tooltip,Tooltip for an MFD button.,Max Alt +,
F-45A_mfd_altitudeSettings:R4_tooltip,Tooltip for an MFD button.,Max Alt -,
F-45A_mfd_altitudeSettings:L2_tooltip,Tooltip for an MFD button.,Toggle Alt Mode,Alternar Modo Alt
StoresManagementPage_MFDPortalPage_pageName,MFD portal page name,Stores Mgmt Sys,Guardar Sis. Gest.
StoresManagementPage_MFDPortalPage_pageLabel,MFD portal page button label,SMS,
s_sms_mode_0,SMS mode button labels,Config,
s_sms_mode_1,SMS mode button labels,Arming,Armar
s_sms_mode_2,SMS mode button labels,Jettison,Solar
s_sms_armed,Armed label for an equip in the SMS config view.,[ ARMED ],[ ARMADO ]
s_sms_disarmed,Disarmed label for an equip in the SMS config view.,DISARMED,DESARMADO
s_sms_jettison,Jettison label for an equip in the SMS config view.,JETTISON,SOLTAR
s_sms_optionToggle,Tooltip prefix for SMS equipment option toggles,Toggle,Alternar
s_sms_optionRipple,Ripple button label for SMS equipment option.,Ripple,Ráfaga
s_sms_rippleSingle,Label for ripple setting set to single-fire (no ripple),Single,Semi
s_bdo_open,SMS bay door override in OPEN position,OPEN,ABIERTO
s_bdo_auto,SMS bay door override in AUTO position,AUTO,
RadarDisplay_MFDPortalPage_pageName,MFD portal page name,Radar,
RadarDisplay_MFDPortalPage_pageLabel,MFD portal page button label,RADAR,
GPSSystem_MFDPortalPage_pageName,MFD portal page name,GPS Targets,Objetivos GPS
GPSSystem_MFDPortalPage_pageLabel,MFD portal page button label,GPST,
EOTSPortalPage_MFDPortalPage_pageName,MFD portal page name,EO Targeting,Apuntado EO
EOTSPortalPage_MFDPortalPage_pageLabel,MFD portal page button label,EOTS,
MFDCommsMenu_MFDPortalPage_pageName,MFD portal page name,Communications,Comunicaciones
MFDCommsMenu_MFDPortalPage_pageLabel,MFD portal page button label,COMMS,
GameMenuPage_MFDPortalPage_pageName,MFD portal page name,Game Menu,Menú Juego
GameMenuPage_MFDPortalPage_pageLabel,MFD portal page button label,GAME,JUEGO
TacticalSituationDisplay_MFDPortalPage_pageName,MFD portal page name,Tactical Situation Display,Pantalla de Situación Táctica
TacticalSituationDisplay_MFDPortalPage_pageLabel,MFD portal page button label,TSD,PST
AIM-120 Advanced Radar Missile x2_fullName,Full equip name of: AIM-120 Advanced Radar Missile x2,AIM-120 Advanced Radar Missile x2,Misil de Radar Avanzado AIM-120 x2
AIM-120 Advanced Radar Missile x2_description,Item description of: AIM-120 Advanced Radar Missile x2,A rack of two radar guided medium range air to air missiles.,Un pilón de 2 misiles Aire-Aire de medio alcance guiado por radar
fa26_loadout_extFuelL,External Fuel Left,Ext fuel l,Comb Ext I
fa26_loadout_extFuelR,External Fuel Right,Ext fuel r,Comb Ext D
fa26_loadout_extFuelC,External Fuel Centerline,Ext fuel center,Comb Ext Central
fa26_loadout_extSensor,External Sensor,Ext sensor,Sensor Ext
fa26_loadout_cft,Conformal Fuel Tank,Cft,Tcc
Mk.82 Bomb x2_fullName,Full equip name of: Mk.82 Bomb x2,Mk.82 Bomb x2,Bomba Mk.82 x2
Mk.82 Bomb x2_description,Item description of: Mk.82 Bomb x2,Two standard un-guided 500lb bombs.,"Dos bombas estandar de 500lb sin guiado "
eqSublabel_BOMB-INTERNAL,HUD sub-label of an equip,BOMB INTERNAL,INTERNO BOMBAS
GAU-8 Avenger_fullName,Full equip name of: GAU-8 Avenger,GAU-8 Avenger,
GAU-8 Avenger_description,Item description of: GAU-8 Avenger,"A 30mm, 7-barrel rotary cannon. Fires depleted uranium rounds at a high rate of fire.",Cañón de 7 cañones de 30mm. Dispara balas de uranio empobrecido a una alta cadencia de fuego.
AN/APG-108 Fire Control Radar_fullName,Full equip name of: AN/APG-108 Fire Control Radar,AN/APG-108 Fire Control Radar,Radar Contro de Tiro AN/APG-108
AN/APG-108 Fire Control Radar_description,Item description of: AN/APG-108 Fire Control Radar,"A millimeter-wave radar housed and mounted over the main rotor. This radar can be used to scan land, sea, and air to detect, track, and classify multiple targets. Its high mounting point allows it to be used while the vehicle remains behind cover.","Un radar de ondas milimétricas alojado y montado sobre el rotor principal. Este radar puede escanear tierra, mar y aire para detectar, seguir y clasificar múltiples objetivos. Su posición elevada permite su uso mientras el vehículo permanece cubierto."
SB-1 x32_fullName,Full equip name of: SB-1 x32,SB-1 x32,
SB-1 x32_description,Item description of: SB-1 x32,A rack of 32 standard un-guided 500lb bombs.,Un Pilón de 32 bombas de 500lb sin guiado.
AIRS-T Advanced SRM_fullName,Full equip name of: AIRS-T Advanced SRM,AIRS-T Advanced SRM,AIRS-T avanzado SRM
AIRS-T Advanced SRM_description,Item description of: AIRS-T Advanced SRM,"Short range heat seeking air to air missile with thrust vectoring.
Improved maneuverability, range, and counter-countermeasure system.
Advanced technology allows it to intercept incoming missiles.","Misil Aire-Aire de corto alcance guiado por calor con empuje vectorial. Maniobravilidad, rango y sistema contra-contramedidas mejorado. Su tecnología avanzada permite interceptar misiles entrantes."
Mk-82AIR High Drag Bomb x1_fullName,Full equip name of: Mk-82AIR High Drag Bomb x1,Mk-82AIR High Drag Bomb x1,Bomba Mk-82AIR x1
Mk-82AIR High Drag Bomb x1_description,Item description of: Mk-82AIR High Drag Bomb x1,Standard un-guided 500lb bomb. Deploys an inflatable drag chute to slow descent for low altitude bombing.,Bomba estandar de 500lb sin guiado. Despliega un paracaídas de descenso lento para bombardeos a baja altitud.
ASF-SRM-RA x1_fullName,Full equip name of: ASF-SRM-RA x1,ASF-SRM-RA x1,
ASF-SRM-RA x1_description,Item description of: ASF-SRM-RA x1,An older rear-aspect heat-seeking anti-air missile.,Un misil anti-aéreo de generación anterior guiado por calor de aspecto trasero.
Mk.82 Bomb x4_fullName,Full equip name of: Mk.82 Bomb x4,Mk.82 Bomb x4,Bomba Mk.82 x4
Mk.82 Bomb x4_description,Item description of: Mk.82 Bomb x4,Four standard un-guided 500lb bombs.,Cuatro bombas estandar de 500lb sin guiado.
ASMRM-7 x8 Internal_fullName,Full equip name of: ASMRM-7 x8 Internal,ASMRM-7 x8 Internal,
ASMRM-7 x8 Internal_description,Item description of: ASMRM-7 x8 Internal,Medium range radar guided air to air missile. Missiles are stowed internally to improve stealth and aerodynamics.,Misil Aire-Aire guiado por radar de medio alcance. Los misiles están almacenados internamente para mejorar la furtividad y la aerodinámica
Mk.83 Bomb x1_fullName,Full equip name of: Mk.83 Bomb x1,Mk.83 Bomb x1,Bomba Mk.83 x1
Mk.83 Bomb x1_description,Item description of: Mk.83 Bomb x1,Standard un-guided 1000lb bomb.,Bomba estandar de 1000lb sin guiado.
AGM-126 SideARM II x3_fullName,Full equip name of: AGM-126 SideARM II x3,AGM-126 SideARM II x3,
AGM-126 SideARM II x3_description,Item description of: AGM-126 SideARM II x3,Compact short range anti-radiation missile based on the AIM-9x.,Misil compacto anti-radiación de corto alcance basado en el AIM-9x
AIM-9 Sidewinder_fullName,Full equip name of: AIM-9 Sidewinder,AIM-9 Sidewinder,
AIM-9 Sidewinder_description,Item description of: AIM-9 Sidewinder,A standard short range heat seeking air to air missile.,Un misil Aire-Aire estandar de corto alcance guiado por calor.
MAD-4A Missile_fullName,Full equip name of: MAD-4A Missile,MAD-4A Missile,Misil MAD-4A
MAD-4A Missile_description,Item description of: MAD-4A Missile,Advanced active radar-guided missile built for the Mobile Air Defense launcher. It has a range of about 55km (30nm).,Misil avanzado guiado por radar activo fabricado para el Lanzador Móvil de Defensa Aérea. Tiene un rango de unos 55km (30nm)
Mk-82 Bomb x1_fullName,Full equip name of: Mk-82 Bomb x1,Mk-82 Bomb x1,Bopmba Mk-82 x1
Mk-82 Bomb x1_description,Item description of: Mk-82 Bomb x1,Standard un-guided 500lb bomb.,Bomba estandar de 500lb sin guiado.
s_cs_granted,Text in campaign selector,Granted,Asignado
s_cs_budget,Text in campaign selector,Budget,Presupuesto
s_cs_newMission,Text in campaign selector,New Mission:,Nueva Misión:
s_cs_newTraining,Text in campaign selector,New Training:,Nuevo Entrenamiento:
s_cs_newEquip,Text in campaign selector,New Equipment:,Nuevo Equipamiento:
s_cs_incompatibleVersion,Text in campaign selector,Incompatible game version,Version de juego incompatible
campaign_customScenarios,,Custom Scenarios,Escenarios Personalizados
campaign_customScenarios_description,,Play custom scenarios created in the VTEditor.,Juega escenarios personalizados creados en el VTEditor.
campaign_ws,,Steam Workshop Scenarios,Escenarios Steam Workshop
campaign_ws_description,,Play custom scenarios installed through Steam Workshop.,Juega escenarios personalizados instalados desde el Steam Workshop
s_cInfo_completed,'x% [Completed]' text in campaign selector,Completed,Completado
GBU-38 Bomb x4_fullName,Full equip name of: GBU-38 Bomb x4,GBU-38 Bomb x4,Bomba GBU-38 x4
GBU-38 Bomb x4_description,Item description of: GBU-38 Bomb x4,500lb GPS guided direct attack munition. It's a Mk.82 bomb with a guidance package strapped on.,Munición de ataque directo guiado por GPS de 500lb. Es una bomba Mk.82 al que se les ha acomodado un paquete de guiado láser.
tutName_Weapon Basics,Name of a legacy tutorial objective,Weapon Basics,Fundamentos de Armamento
tutDesc_Weapon Basics,Description of a legacy tutorial,Complete the tutorial.,Completa el tutorial
tut:Weapon Basics:Intro10,A tutorial label,Welcome to the basic weapons tutorial.,Bienvenido al entrenamiento básico de armamento.
tut:Weapon Basics:Intro21,A tutorial label,"Today, we will be covering weapon configuration, target acquisition, and firing weapons.","Hoy, vamos a cubir las configuraciones de armamento, adquisición de objetivo y disparar armamento."
tut:Weapon Basics:Intro32,A tutorial label,Let's start by setting the MFDs to the pages we will use.,Empecemos configurando las MFDs en las páginas que vamos a usar.
tut:Weapon Basics:MFD3GoHome3,A tutorial label,Go to HOME page.,Vamos a la página INICIO.
tut:Weapon Basics:Open EQUIP4,A tutorial label,Open EQUIP,Abre EQUIP
tut:Weapon Basics:MFD2GoHome5,A tutorial label,Go to HOME page.,Ve a la página INICIO.
tut:Weapon Basics:Open TGP6,A tutorial label,Open TGP,Abre TGP
tut:Weapon Basics:MFD1GoHome7,A tutorial label,Go to HOME page.,Ve a la página INICIO.
tut:Weapon Basics:Open NAV8,A tutorial label,Open NAV,Abre NAV
tut:Weapon Basics:EQUIP info9,A tutorial label,The EQUIP page shows what you have on each of the vehicle's equipment mounts.,La página EQUIP muestra que tienes equipado en cada punto de anclaje del vehículo.
tut:Weapon Basics:EQUIP info 210,A tutorial label,"It displays information on each item, and allows you to arm/disarm, configure, or mark them for jettison.","Muestra información de cada armamento, y te permite armar/desarmar, configurar o marcarlos para soltar la carga."
tut:Weapon Basics:EQUIP info 311,A tutorial label,We'll go over each feature in more detail later.,Vamos a ir por cada cosilla más adelante.
tut:Weapon Basics:TGP info12,A tutorial label,The TGP is what you will use to acquire ground targets.,El TGP se usa para adquirir objetivos terrestres.
tut:Weapon Basics:TGP info 213,A tutorial label,"To use it, first you must supply power to the sensor mounted under the nose of the vehicle.","Para usarlo, primero debes encender el sensor montado bajo el morro del vehículo."
tut:Weapon Basics:PWR on TGP14,A tutorial label,Enable TGP power.,Enciende el TGP.
tut:Weapon Basics:TGP info 315,A tutorial label,"The TGP will be in FWD mode by default, which just looks straight forward.","El TGP ahora va a estar en el modo ADEL. por defecto, que significa que simplemente esta mirando hacia delante en todo momento."
tut:Weapon Basics:TGP info 416,A tutorial label,"To be able to control it, you must designate the TGP as the sensor of interest (SOI).","Para controlarlo, debes designar el TGP como el sensor de interés (SOI)."
tut:Weapon Basics:Enable TGP SOI17,A tutorial label,Enable SOI,Habilita el SOI
tut:Weapon Basics:Slew TGP info18,A tutorial label,"Now, you can slew the targeting sensor around using the thumb control on your joystick.","Ahora, puedes mover el sensor usando el control del pulgar en tu joystick."
tut:Weapon Basics:TrySlewing19,A tutorial label,Try slewing the TGP around using the joystick thumb control.,Intenta mover el TGP usando el control del pulgar del joystick.
tut:Weapon Basics:Slew TGP info 220,A tutorial label,"When you move the sensor, it will auto switch to TGT mode, which locks its focus point on the ground while you're flying.","Cuando mueves el sensor, se cambiará automáticamente al modo TGT, que se bloqueará en el punto del suelo donde hayas mirado mientras vuelas."
tut:Weapon Basics:Slew TGP info 321,A tutorial label,The yellow arrow on the screen shows the relative bearing to the target point.,La flecha amarilla en la pantalla muestra el rumbo relativo al punto objetivo.
tut:Weapon Basics:TGP info 522,A tutorial label,The target point also shows up on the NAV map as a yellow cross.,El punto objetivo tambien se muestra en el mapa del NAV como una cruz amarilla.
tut:Weapon Basics:Now lets take off23,A tutorial label,Now let's find some targets.  Take off and fly to the objective waypoint.,Ahora busquemos algunos objetivos. Despega y vuela hacia el punto objetivo.
tut:Weapon Basics:Brakes OFF24,A tutorial label,Unlock Brakes,Quita el freno de mano
tut:Weapon Basics:Fly to AO25,A tutorial label,,
tut:Weapon Basics:MasterArmInfo26,A tutorial label,"Now that we are in the AO, you can enable the Master Arm switch.","Ahora que estamos en AO, habilita el switch de armamento maestro."
tut:Weapon Basics:MasterArm ON27,A tutorial label,Enable Master Arm,Habilita el armamento maestro
tut:Weapon Basics:MasterArmInfo228,A tutorial label,"With the weapon system armed, you will see some new icons on the HUD","Con el sistema de armamento armado, verás algunos nuevos iconos en el HUD"
tut:Weapon Basics:ReticleInfo29,A tutorial label,"At the center, you have the weapon targeting reticle or pipper.","En el centro, tienes la retícula del apuntado del arma o pipper."
tut:Weapon Basics:WeaponInfo30,A tutorial label,"Here, you have weapon type, name, and shots remaining.","Aquí, tienes el tipo de arma, nombre y munición restante."
tut:Weapon Basics:WeaponSwitching31,A tutorial label,You can cycle through all ARMED weapons by pressing the button on the joystick.,Puedes ciclar entre todas las armas armadas presionando el botón en el joystick
tut:Weapon Basics:WeaponSwitching32,A tutorial label,Switch to HYDRA70,Cambia a HYDRA70
tut:Weapon Basics:WeaponSwitching33,A tutorial label,Switch to GAU-8,Cambia al GAU-8
tut:Weapon Basics:Firing34,A tutorial label,These unguided weapons can be fired by simply pulling the trigger on the joystick.,Estas armas sin guiado pueden ser disparadas simplemente pulsando el gatillo del joystick.
tut:Weapon Basics:Firing 235,A tutorial label,You have limited stores so save your rounds for the targets.,Tienes munición limitada así que guardalas para los objetivos.
tut:Weapon Basics:GunMission136,A tutorial label,Let's try deploying the GAU-8 on some ground targets.,Vamos a intentar usar la GAU-8 en algunos objetivos terrestres.
tut:Weapon Basics:GunMission237,A tutorial label,"In a moment, you'll receive a mission objective.","En un momento, recibirás la misión objetivo."
tut:Weapon Basics:GunMission338,A tutorial label,You can auto-slew your TGP to the objective waypoint by pressing the WPT button in the TGP screen.,Puedes mover tu TGP al punto objetivo pulsando el botón PUNTO en la pantalla del TGP.
tut:Weapon Basics:GunMission4 Start39,A tutorial label,Go ahead and destroy the tanks.,Ve y destruye los tanques.
tut:Weapon Basics:GunMission40,A tutorial label,,
tut:Weapon Basics:GoodJobGuns41,A tutorial label,Great job!  Now let's work with rockets.,¡Buen trabajo! Ahora usemos los cohetes.
tut:Weapon Basics:SwitchToRockets42,A tutorial label,Switch to HYDRA70,Cambia a los HYDRA70
tut:Weapon Basics:Rocket info43,A tutorial label,"Hydra 70's are small, unguided rockets.",Los Hydra 70 son cohetes pequeños no guiados.
tut:Weapon Basics:Rocket info 244,A tutorial label,"By default, each pull of the trigger will fire one rocket.","Por defecto, cada vez que presionas el gatillo solo disparará un cohete."
tut:Weapon Basics:Rocket info 345,A tutorial label,"However, they can be configured to launch rapidly.  This is called 'ripple' firing.","Sin embargo, pueden ser configurados para disparar rápidamente. Esto se llama disparar en 'ráfaga'."
